{"schemaVersion":"0.1.0-poc","provider":{"name":"calcite-semantic-provider","calciteVersion":"1.42.0","adapterVersion":"0.1.0","buildFingerprint":"0000000000000000000000000000000000000000000000000000000000000000"},"input":{"sqlSourceId":"slot:demo","statementOrdinal":0,"sqlSha256":"1111111111111111111111111111111111111111111111111111111111111111","schemaSha256":"2222222222222222222222222222222222222222222222222222222222222222","dialectDigest":"3333333333333333333333333333333333333333333333333333333333333333"},"statementStatus":"SUCCESS","capabilities":[{"capability":"EXPRESSION_LINEAGE","evaluationStatus":"EVALUATED"}],"relations":[{"relationId":"rel:0","kind":"TABLE_SCAN","inputRelationIds":[],"outputFieldIds":["field:0"]}],"fields":[{"fieldId":"field:0","relationId":"rel:0","role":"OUTPUT","slot":0,"name":"amount","typeName":"DECIMAL","nullable":true,"physicalFieldId":"physical:demo.trade.amount"}],"operators":[{"operatorId":"op:0","kind":"TABLE_SCAN","relationId":"rel:0","inputRelationIds":[]}],"dependencies":[{"dependencyId":"dep:0","dependencyKind":"VALUE_INPUT","impactKind":"FIELD_VALUE","operatorId":"op:0","fromRefs":["field:0"],"toRefs":["field:0"],"evaluationStatus":"EVALUATED","evidenceMappingRefs":["mapping:0"],"issueRefs":[]}],"metadata":[{"metadataId":"metadata:0","kind":"EXPRESSION_LINEAGE","subjectRef":"field:0","evaluationStatus":"EVALUATED","knowledgeStatus":"EXACT","basis":"CALCITE_REX_INPUT_REF","absenceProven":false,"value":["field:0"]}],"evidenceMappings":[{"mappingId":"mapping:0","providerRefId":"field:0","nativeRefId":"native:field:0","mappingStatus":"EXACT","evidenceRefs":["evidence:field:0"],"sourceSpan":{"start":7,"end":13}}],"issues":[]}
